<?xml version="1.0" encoding="UTF-8"?>
<prijava xmlns="http://www.ftn.uns.ac.rs/patent"
    xmlns:xsi="http://www.w3.org/2001/XMLSchema-instance"
    xsi:schemaLocation="http://www.ftn.uns.ac.rs/patent ../../Patent.xsd">
    <detalji_prijave>
        <broj_prijave>1</broj_prijave>
        <datum_podnosenja>2000-01-01</datum_podnosenja>
        <priznati_datum_podnosenja>2000-01-01</priznati_datum_podnosenja>
        <potpis></potpis>
        <pecat></pecat>
    </detalji_prijave>
    <zahtev>
        <naziv_pronalaska>
            <srpski_naziv></srpski_naziv>
            <engleski_naziv></engleski_naziv>
        </naziv_pronalaska>
        <podnosilac_prijave>
            <adresa>
                <ulica></ulica>
                <broj></broj>
                <postanski_broj>11000</postanski_broj>
                <mesto></mesto>
                <drzava></drzava>
            </adresa>
            <kontakt>
                <broj_telefona></broj_telefona>
                <broj_faksa></broj_faksa>
                <e_posta></e_posta>
            </kontakt>
            <drzavljanstvo></drzavljanstvo>
        </podnosilac_prijave>
        <pronalazac>
            <adresa>
                <ulica></ulica>
                <broj></broj>
                <postanski_broj>11000</postanski_broj>
                <mesto></mesto>
                <drzava></drzava>
            </adresa>
            <kontakt>
                <broj_telefona></broj_telefona>
                <broj_faksa></broj_faksa>
                <e_posta></e_posta>
            </kontakt>
        </pronalazac>
        <punomocnik>
            <adresa>
                <ulica></ulica>
                <broj></broj>
                <postanski_broj>11000</postanski_broj>
                <mesto></mesto>
                <drzava></drzava>
            </adresa>
            <kontakt>
                <broj_telefona></broj_telefona>
                <broj_faksa></broj_faksa>
                <e_posta></e_posta>
            </kontakt>
        </punomocnik>
        <adresa_za_dostavljanje>
            <ulica></ulica>
            <broj></broj>
            <postanski_broj>11000</postanski_broj>
            <mesto></mesto>
            <drzava></drzava>
        </adresa_za_dostavljanje>
        <nacin_dostavljanja>
            <elektronsko>false</elektronsko>
            <papirno>true</papirno>
        </nacin_dostavljanja>
        <tip_prijave>dopunska</tip_prijave>
        <prvobitna_prijava>
            <broj_prijave>1</broj_prijave>
            <datum_podnosenja>2000-01-01</datum_podnosenja>
        </prvobitna_prijava>
        <prethodne_prijave>
            <prethodna_prijava>
                <broj_prijave>1</broj_prijave>
                <datum_podnosenja>2000-01-01</datum_podnosenja>
                <dvoslovna_oznaka>SR</dvoslovna_oznaka>
            </prethodna_prijava>
        </prethodne_prijave>
        <dodatni_podaci>true</dodatni_podaci>
    </zahtev>
</prijava>